{
    "apiVersion": "1.2",
    "version": "1.0",
    "name": "Mod starter",
    "id": "js-dev-starter",
    "icon": "icon.svg",
    "properties": [
        {
            "name": "myProperty",
            "type": "string",
            "defaultValue": "myValue"
        }
    ],
    "dataViewDefinition": {
        "colorAxis": {
            "mode": "dual",
            "dropTarget": {
                "icon": "Color",
                "description": "Color by {0}"
            }
        },
        "axes": [
            {
                "name": "X",
                "mode": "categorical",
                "placement": "bottom",
                "dropTarget": {
                    "icon": "XAxis3D",
                    "description": "Use {0} on the mod's X-axis"
                }
            },
            {
                "name": "Y",
                "mode": "continuous",
                "placement": "left"
            }
        ]
    },
    "files": [
        "index.html",
        "main.css",
        "main.js"
    ]
}